{
  "id": "2026-08-02-cbs-news-chicago-illinois-secretary-of-state-alexi-giannoulias-announces-campaign-for-c",
  "url": "https://www.cbsnews.com/chicago/news/illinois-secretary-of-state-alexi-giannoulias-campaign-chicago-mayor/",
  "outlet": "CBS News Chicago",
  "media_type": "article",
  "title": "Illinois Secretary of State Alexi Giannoulias announces campaign for Chicago mayor",
  "published_date": "2026-08-02",
  "discovered_date": "2026-09-01",
  "transcript_ref": null,
  "statements": [
    {
      "candidate": "alexi-giannoulias",
      "topic": "affordable-housing-funding",
      "stance": "supports",
      "summary": "Calls for construction of housing that working Chicagoans can afford.",
      "quote": "He called for policies such as universal pre-K for Chicago's children, raising the minimum wage, and construction of housing that working Chicagoans can afford.",
      "locator": null,
      "confidence": 0.9,
      "is_housing": true,
      "attribution_flag": false
    },
    {
      "candidate": "alexi-giannoulias",
      "topic": "affordable-housing-funding",
      "stance": "supports",
      "summary": "States Chicago should never become a city reserved only for the wealthy.",
      "quote": "\"Chicago should never become a city reserved only for the wealthy,\" he said.",
      "locator": null,
      "confidence": 0.9,
      "is_housing": true,
      "attribution_flag": false
    }
  ]
}
