{
  "id": "2026-07-06-example-forum",
  "url": "https://example.com/candidate-forum-2026-07-06",
  "outlet": "EXAMPLE — Neighborhood Housing Forum",
  "media_type": "manual",
  "title": "EXAMPLE candidate forum on housing (placeholder sample data)",
  "published_date": "2026-07-06",
  "discovered_date": "2026-07-07",
  "transcript_ref": null,
  "statements": [
    {
      "candidate": "example-candidate-a",
      "topic": "zoning-reform",
      "stance": "supports",
      "summary": "Would legalize apartments in every ward and end single-family-only zoning.",
      "quote": "We can't say we want affordability and then ban apartments in half the city.",
      "locator": "12:04",
      "confidence": 0.92,
      "is_housing": true,
      "attribution_flag": false
    },
    {
      "candidate": "example-candidate-a",
      "topic": "affordable-housing-funding",
      "stance": "supports-with-conditions",
      "summary": "Supports expanding the housing trust fund but wants an audit of existing spending first.",
      "quote": "I'll grow the trust fund, but not before we account for the dollars already out the door.",
      "locator": "18:41",
      "confidence": 0.8,
      "is_housing": true,
      "attribution_flag": false
    },
    {
      "candidate": "example-candidate-b",
      "topic": "zoning-reform",
      "stance": "opposes",
      "summary": "Opposes citywide upzoning; favors keeping land-use decisions with local aldermen.",
      "quote": "Neighborhoods, not City Hall, should decide what gets built on their blocks.",
      "locator": "24:15",
      "confidence": 0.88,
      "is_housing": true,
      "attribution_flag": false
    }
  ]
}
